{
  "schema": "kalama.patch-assist-prototype/evaluation-result/v1",
  "experiment_id": "EXP-DEMO-001",
  "run_id": "RUN-DEMO",
  "action_id": "patch-001",
  "arm": "ARM_B_L3",
  "counts": {
    "field_count": 9,
    "no_edit_count": 6,
    "minor_edit_count": 1,
    "major_edit_count": 0,
    "reject_count": 0,
    "abstention_accepted_count": 2,
    "unsupported_claim_count": 0,
    "missing_citation_count": 0,
    "invalid_evidence_reference_count": 0,
    "semantic_critical_edit_count": 0
  },
  "rates": {
    "agent_supported_field_rate": 0.75,
    "human_refinement_rate": 0.1667,
    "major_refinement_rate": 0.0,
    "unsupported_claim_rate": 0.0,
    "citation_validity_rate": 1.0,
    "abstention_correctness_rate": 1.0
  },
  "validator": {
    "validator_pass_before_review": true,
    "validator_pass_after_review": true
  },
  "durations": {
    "review_duration_seconds": 900,
    "agent_duration_seconds": 120
  },
  "per_field": {
    "fix_type": {"review_class": "NO_EDIT", "unsupported_claim": false, "citation_valid": true},
    "strategy": {"review_class": "NO_EDIT", "unsupported_claim": false, "citation_valid": true},
    "target_version": {"review_class": "MINOR_EDIT", "unsupported_claim": false, "citation_valid": true},
    "artifact_source": {"review_class": "NO_EDIT", "unsupported_claim": false, "citation_valid": true},
    "source_identifier": {"review_class": "NO_EDIT", "unsupported_claim": false, "citation_valid": true},
    "build_system": {"review_class": "NO_EDIT", "unsupported_claim": false, "citation_valid": true},
    "command": {"review_class": "ABSTENTION_ACCEPTED", "unsupported_claim": false, "citation_valid": true},
    "validation_command": {"review_class": "ABSTENTION_ACCEPTED", "unsupported_claim": false, "citation_valid": true},
    "notes": {"review_class": "NO_EDIT", "unsupported_claim": false, "citation_valid": true}
  },
  "created_at": "2099-01-04T01:00:00Z"
}
